{
  "continuous_intake": [
    "discover_from_monitored_primary_sources",
    "screen_provenance_license_runtime_and_interface",
    "prepare_approved_assets_in_isolation",
    "qualify_on_an_exact_environment_workload_and_protocol",
    "activate_reviewed_evidence",
    "promote_through_a_separate_human_review",
    "monitor_expiry_runtime_drift_and_regressions",
    "revoke_or_roll_back_without_reusing_invalid_evidence"
  ],
  "generated_report": "reports/adaptive_vision_roadmap.md",
  "guardrails": [
    "Unknown or unavailable evidence never counts as zero, absent, passing, supported, or qualified.",
    "Recommendation and execution do not download models, code, or datasets; acquisition is a separate approved operation with source, license, and SHA-256 checks.",
    "Images, prompts, filenames, host identifiers, raw event telemetry, private messages, and user datasets are not exported as roadmap or qualification evidence.",
    "Candidate discovery cannot promote or replace a bundle; promotion, revocation, and rollback require separate reviewed records.",
    "Research candidates, model-card metrics, imports, and smoke runs cannot establish a public support or performance claim.",
    "A missing exact environment, workload, protocol, artifact, license, or quality match results in hold, blocked, or abstained rather than an inferred fallback.",
    "OSS completion requires truthful supported, unverified, or abstained results; it does not require official hardware, design-partner, on-prem, adoption, or commercial support evidence."
  ],
  "kind": "adaptive_vision_roadmap_projection",
  "next_issue_id": "YOLOZU-ll2.81.3.2",
  "out_of_scope": [
    "hosted image inference",
    "implicit model or dependency installation",
    "universal best or always-latest claims",
    "RTSP in the first stream lane",
    "multiple concurrent streams",
    "image enhancement",
    "biometric or cross-stream identity",
    "hard real-time guarantees",
    "official CPU, Apple, or NVIDIA adaptive-bundle qualification",
    "mandatory design-partner or on-prem adoption validation",
    "commercial support matrices and quarterly product reviews",
    "streaming, tracking, or OCR runtime work without renewed community demand",
    "third-party isolated runner work without renewed community demand",
    "high-cost real-image efficacy benchmarks outside opt-in research"
  ],
  "phases": [
    {
      "child_issue_count": 15,
      "deliverable": "Typed interface contracts, privacy-safe environment profiling, evidence records, deterministic abstaining selection, read-only recommendation, and pinned local execution for bounded images.",
      "issue_id": "YOLOZU-ll2.81.1",
      "order": 1,
      "priority": "P0",
      "state": "roadmap",
      "title": "Build deterministic adaptive-routing foundation"
    },
    {
      "child_issue_count": 10,
      "deliverable": "Honest baseline registration and governed screening of initial open-vocabulary and low-latency families. Adapters require approval; exact-host qualification is optional community evidence and is never inferred.",
      "issue_id": "YOLOZU-ll2.81.2",
      "order": 2,
      "priority": "P1",
      "state": "roadmap",
      "title": "Register and screen initial algorithm bundles"
    },
    {
      "child_issue_count": 11,
      "deliverable": "Monitored-source discovery, fail-closed screening, evidence freshness monitoring, reviewed promotion, terminal revocation, rollback, and failure drills. Third-party isolation remains none_supported unless renewed demand creates new work.",
      "issue_id": "YOLOZU-ll2.81.3",
      "order": 3,
      "priority": "P1",
      "state": "roadmap",
      "title": "Automate evidence-gated algorithm intake and rollback"
    },
    {
      "child_issue_count": 3,
      "deliverable": "Published OSS boundary: design-partner and on-prem results are optional community evidence, never required completion or inferred adoption or support.",
      "issue_id": "YOLOZU-ll2.81.4",
      "order": 4,
      "priority": "P1",
      "state": "roadmap",
      "title": "Document optional on-prem validation boundary"
    },
    {
      "child_issue_count": 13,
      "deliverable": "Retain bounded local-stream, session-tracking, and static-image OCR interface contracts. Runtime, routing, and qualification work is not planned until renewed community demand creates new Beads.",
      "issue_id": "YOLOZU-ll2.81.5",
      "order": 5,
      "priority": "P2",
      "state": "roadmap",
      "title": "Retain contract-only streaming, tracking, and OCR lanes"
    }
  ],
  "product_boundary": {
    "current_stable_lane": "prediction validation and evaluation through the predictions interface contract",
    "execution_boundary": "Local and offline after explicitly approved assets are present; no implicit download or runner-requested network access.",
    "natural_language_boundary": "The AI client compiles free-form instructions into a typed request; the YOLOZU core does not embed an LLM.",
    "public_availability": "future_experimental_work",
    "recommendation_boundary": "Highest-ranked only among candidates with matching qualification evidence and all stated constraints; otherwise abstain.",
    "target_maturity": "Experimental"
  },
  "schema_version": 1,
  "scope": {
    "initial_inputs": [
      "single_image",
      "bounded_directory"
    ],
    "initial_tasks": [
      "object_detection",
      "instance_segmentation"
    ],
    "later_bounded_lanes": [
      "local_stream",
      "session_tracking",
      "static_image_ocr"
    ],
    "selection_factors": [
      "task and prompt mode",
      "CPU or accelerator availability",
      "runtime and precision",
      "memory limits",
      "batch or soft-real-time SLO",
      "quality protocol and vocabulary",
      "offline and license policy"
    ]
  },
  "snapshot": {
    "beads_export_commit": "5b2ba1c8b26565a10e50e748906db2ded27fb31f",
    "date": "2026-08-29",
    "planning_source": "Beads",
    "planning_source_doc": "docs/roadmap.md",
    "root_issue_id": "YOLOZU-ll2.81",
    "timezone": "Asia/Tokyo"
  },
  "source_of_truth": {
    "capability_boundary": "yolozu/data/manifest/adaptive_vision_roadmap.json",
    "generated_human_report": "reports/adaptive_vision_roadmap.md",
    "live_task_state": "Refresh Beads with bash refresh_beads_sync.sh before relying on issue status"
  }
}
